{
  "id": "GSIL.SPECIMEN.DECISION_FRAME.OPENER.001",
  "format": "instagram_4x5",
  "role": "carousel_opener",
  "mode": "forest",
  "pattern": {
    "behaviour": "passage",
    "orientation": 90,
    "prominence": "signature",
    "instances": 1,
    "S": 360,
    "region": {"x": 660, "y": 38, "width": 360, "height": 360}
  },
  "content": {
    "eyebrow": "DECISION FRAME · 01",
    "headline": "Better analysis cannot rescue the wrong frame.",
    "headline_lines": ["Better analysis", "cannot rescue", "the wrong frame."],
    "headline_y": 420,
    "body": "Before asking AI for an answer, establish what is actually being decided and why now.",
    "body_lines": ["Before asking AI for an answer,", "establish what is actually being", "decided and why now."],
    "body_y": 790,
    "source": "GreenSquare Judgment OS · Frame before analysing",
    "source_state": "GIVEN",
    "protected_region": {"x": 84, "y": 300, "width": 550, "height": 690}
  }
}
